{
  "schema": "humanoid_rig/anatomical_profile@1.0",
  "schemaVersion": 1,
  "type": "CompiledAnatomicalProfile",
  "profileId": "compiled-anatomical-skeleton-s1-baseline",
  "revision": 1,
  "sourceSkeletalDnaId": "anatomical-skeleton-s1-baseline",
  "coordinateSystem": {
    "handedness": "right-handed",
    "upAxis": "+Y",
    "forwardAxis": "+Z",
    "rightAxis": "+X",
    "unit": "meter"
  },
  "rootJointId": "pelvis",
  "joints": [
    {
      "boneId": "pelvis",
      "jointId": "pelvis",
      "parentJointId": null,
      "bindLocalPosition": [
        0,
        0.9649999737739563,
        0
      ],
      "bindLocalRotation": [
        0,
        0,
        0,
        1
      ],
      "boneLength": 0.20999999344348907,
      "jointCenter": [
        0,
        0.9649999737739563,
        0
      ],
      "jointBasis": {
        "x": [
          1,
          0,
          0
        ],
        "y": [
          0,
          1,
          0
        ],
        "z": [
          0,
          0,
          1
        ]
      },
      "degreesOfFreedom": [
        "swingX",
        "swingZ",
        "twist"
      ],
      "softLimits": {
        "swingX": [
          0,
          0
        ],
        "swingZ": [
          0,
          0
        ],
        "twist": [
          0,
          0
        ]
      },
      "hardLimits": {
        "swingX": [
          0,
          0
        ],
        "swingZ": [
          0,
          0
        ],
        "twist": [
          0,
          0
        ]
      },
      "segmentMass": 0.1420000046491623,
      "localCenterOfMass": [
        0,
        0,
        0
      ],
      "symmetryPairId": null,
      "footContactFrame": null,
      "handGripFrame": null,
      "humanRigCoreJointId": "hips",
      "mappingStatus": "exact"
    },
    {
      "boneId": "spine_low",
      "jointId": "spine_low",
      "parentJointId": "pelvis",
      "bindLocalPosition": [
        0,
        0.10200005769729614,
        0
      ],
      "bindLocalRotation": [
        0,
        0,
        0,
        1
      ],
      "boneLength": 0.10200005769729614,
      "jointCenter": [
        0,
        1.0670000314712524,
        0
      ],
      "jointBasis": {
        "x": [
          1,
          0,
          0
        ],
        "y": [
          0,
          1,
          0
        ],
        "z": [
          0,
          0,
          1
        ]
      },
      "degreesOfFreedom": [],
      "softLimits": {
        "swingX": [
          0,
          0
        ],
        "swingZ": [
          0,
          0
        ],
        "twist": [
          0,
          0
        ]
      },
      "hardLimits": {
        "swingX": [
          0,
          0
        ],
        "swingZ": [
          0,
          0
        ],
        "twist": [
          0,
          0
        ]
      },
      "segmentMass": 0.07999999821186066,
      "localCenterOfMass": [
        0,
        0.05100002884864807,
        0
      ],
      "symmetryPairId": null,
      "footContactFrame": null,
      "handGripFrame": null,
      "humanRigCoreJointId": "spine",
      "mappingStatus": "exact"
    },
    {
      "boneId": "spine_mid",
      "jointId": "spine_mid",
      "parentJointId": "spine_low",
      "bindLocalPosition": [
        0,
        0.13769996166229248,
        0
      ],
      "bindLocalRotation": [
        0,
        0,
        0,
        1
      ],
      "boneLength": 0.13769996166229248,
      "jointCenter": [
        0,
        1.204699993133545,
        0
      ],
      "jointBasis": {
        "x": [
          1,
          0,
          0
        ],
        "y": [
          0,
          1,
          0
        ],
        "z": [
          0,
          0,
          1
        ]
      },
      "degreesOfFreedom": [],
      "softLimits": {
        "swingX": [
          0,
          0
        ],
        "swingZ": [
          0,
          0
        ],
        "twist": [
          0,
          0
        ]
      },
      "hardLimits": {
        "swingX": [
          0,
          0
        ],
        "swingZ": [
          0,
          0
        ],
        "twist": [
          0,
          0
        ]
      },
      "segmentMass": 0.07999999821186066,
      "localCenterOfMass": [
        0,
        0.06884998083114624,
        0
      ],
      "symmetryPairId": null,
      "footContactFrame": null,
      "handGripFrame": null,
      "humanRigCoreJointId": "chest",
      "mappingStatus": "exact"
    },
    {
      "boneId": "spine_high",
      "jointId": "spine_high",
      "parentJointId": "spine_mid",
      "bindLocalPosition": [
        0,
        0.13769996166229248,
        0
      ],
      "bindLocalRotation": [
        0,
        0,
        0,
        1
      ],
      "boneLength": 0.13769996166229248,
      "jointCenter": [
        0,
        1.3423999547958374,
        0
      ],
      "jointBasis": {
        "x": [
          1,
          0,
          0
        ],
        "y": [
          0,
          1,
          0
        ],
        "z": [
          0,
          0,
          1
        ]
      },
      "degreesOfFreedom": [],
      "softLimits": {
        "swingX": [
          0,
          0
        ],
        "swingZ": [
          0,
          0
        ],
        "twist": [
          0,
          0
        ]
      },
      "hardLimits": {
        "swingX": [
          0,
          0
        ],
        "swingZ": [
          0,
          0
        ],
        "twist": [
          0,
          0
        ]
      },
      "segmentMass": 0.07999999821186066,
      "localCenterOfMass": [
        0,
        0.06884998083114624,
        0
      ],
      "symmetryPairId": null,
      "footContactFrame": null,
      "handGripFrame": null,
      "humanRigCoreJointId": "upperChest",
      "mappingStatus": "exact"
    },
    {
      "boneId": "chest",
      "jointId": "chest",
      "parentJointId": "spine_high",
      "bindLocalPosition": [
        0,
        0.1326000690460205,
        0
      ],
      "bindLocalRotation": [
        0,
        0,
        0,
        1
      ],
      "boneLength": 0.1326000690460205,
      "jointCenter": [
        0,
        1.475000023841858,
        0
      ],
      "jointBasis": {
        "x": [
          1,
          0,
          0
        ],
        "y": [
          0,
          1,
          0
        ],
        "z": [
          0,
          0,
          1
        ]
      },
      "degreesOfFreedom": [],
      "softLimits": {
        "swingX": [
          0,
          0
        ],
        "swingZ": [
          0,
          0
        ],
        "twist": [
          0,
          0
        ]
      },
      "hardLimits": {
        "swingX": [
          0,
          0
        ],
        "swingZ": [
          0,
          0
        ],
        "twist": [
          0,
          0
        ]
      },
      "segmentMass": 0.07999999821186066,
      "localCenterOfMass": [
        0,
        0.06630003452301025,
        0
      ],
      "symmetryPairId": null,
      "footContactFrame": null,
      "handGripFrame": null,
      "humanRigCoreJointId": "upperChest",
      "mappingStatus": "derived"
    },
    {
      "boneId": "neck",
      "jointId": "neck",
      "parentJointId": "chest",
      "bindLocalPosition": [
        0,
        0.10500001907348633,
        0
      ],
      "bindLocalRotation": [
        0,
        0,
        0,
        1
      ],
      "boneLength": 0.10500001907348633,
      "jointCenter": [
        0,
        1.5800000429153442,
        0
      ],
      "jointBasis": {
        "x": [
          1,
          0,
          0
        ],
        "y": [
          0,
          1,
          0
        ],
        "z": [
          0,
          0,
          1
        ]
      },
      "degreesOfFreedom": [
        "swingX",
        "swingZ",
        "twist"
      ],
      "softLimits": {
        "swingX": [
          -42.5,
          42.5
        ],
        "swingZ": [
          -38.25,
          38.25
        ],
        "twist": [
          -59.5,
          59.5
        ]
      },
      "hardLimits": {
        "swingX": [
          -50,
          50
        ],
        "swingZ": [
          -45,
          45
        ],
        "twist": [
          -70,
          70
        ]
      },
      "segmentMass": 0.019999999552965164,
      "localCenterOfMass": [
        0,
        0.052500009536743164,
        0
      ],
      "symmetryPairId": null,
      "footContactFrame": null,
      "handGripFrame": null,
      "humanRigCoreJointId": "neck",
      "mappingStatus": "exact"
    },
    {
      "boneId": "head",
      "jointId": "head",
      "parentJointId": "neck",
      "bindLocalPosition": [
        0,
        0.14499998092651367,
        0
      ],
      "bindLocalRotation": [
        0,
        0,
        0,
        1
      ],
      "boneLength": 0.14499998092651367,
      "jointCenter": [
        0,
        1.725000023841858,
        0
      ],
      "jointBasis": {
        "x": [
          1,
          0,
          0
        ],
        "y": [
          0,
          1,
          0
        ],
        "z": [
          0,
          0,
          1
        ]
      },
      "degreesOfFreedom": [],
      "softLimits": {
        "swingX": [
          0,
          0
        ],
        "swingZ": [
          0,
          0
        ],
        "twist": [
          0,
          0
        ]
      },
      "hardLimits": {
        "swingX": [
          0,
          0
        ],
        "swingZ": [
          0,
          0
        ],
        "twist": [
          0,
          0
        ]
      },
      "segmentMass": 0.019999999552965164,
      "localCenterOfMass": [
        0,
        0.07249999046325684,
        0
      ],
      "symmetryPairId": null,
      "footContactFrame": null,
      "handGripFrame": null,
      "humanRigCoreJointId": "head",
      "mappingStatus": "exact"
    },
    {
      "boneId": "left_clavicle",
      "jointId": "left_clavicle",
      "parentJointId": "chest",